{
  "schemaVersion": "1.0.0",
  "createdAt": "2026-08-26",
  "notice": "Dix démonstrations de recherche, jamais publiables automatiquement. Les faits reproduisent uniquement des métadonnées minimisées ; les témoignages synthétiques sont des observations déclaratives. Toute interprétation, estimation ou recommandation est explicitement typée et reste soumise à revue humaine.",
  "provenanceDisplayContract": {
    "showOriginBeforeInterpretation": true,
    "requiredOriginFields": ["sourceLabel", "canonicalUrl", "capturedStatement", "captureDate", "evidenceMode"],
    "derivedSectionLabel": "Analyse et hypothèses Idea Commons",
    "marketClaimsRequireIndependentCitations": true
  },
  "cases": [
    {
      "id": "population-service-capacity",
      "evidenceMode": "live_minimized",
      "rightsBasis": "compatible_license",
      "evidence": [
        {"id":"wb-2023","sourceId":"world-bank-benin-indicators","collectedIdentifier":"BEN:SP.POP.TOTL:2023","fixtureFile":"editorial/research/fixtures/live-sample-minimized.json","fixturePointer":"/records/world-bank-2023","statement":"La valeur collectée pour l'indicateur Population, total — Benin est 14 111 034 en 2023.","sourceUrl":"https://api.worldbank.org/v2/country/BEN/indicator/SP.POP.TOTL?format=json&per_page=3"},
        {"id":"wb-2024","sourceId":"world-bank-benin-indicators","collectedIdentifier":"BEN:SP.POP.TOTL:2024","fixtureFile":"editorial/research/fixtures/live-sample-minimized.json","fixturePointer":"/records/world-bank-2024","statement":"La valeur collectée pour le même indicateur est 14 462 724 en 2024.","sourceUrl":"https://api.worldbank.org/v2/country/BEN/indicator/SP.POP.TOTL?format=json&per_page=3"},
        {"id":"wb-2025","sourceId":"world-bank-benin-indicators","collectedIdentifier":"BEN:SP.POP.TOTL:2025","fixtureFile":"editorial/research/fixtures/live-sample-minimized.json","fixturePointer":"/records/world-bank-2025","statement":"La valeur collectée pour le même indicateur est 14 814 460 en 2025.","sourceUrl":"https://api.worldbank.org/v2/country/BEN/indicator/SP.POP.TOTL?format=json&per_page=3"}
      ],
      "interpretationAngles": [
        {"type":"hypothesis","statement":"Une population nationale en hausse pourrait accroître la difficulté de dimensionner certains services locaux."},
        {"type":"hypothesis","statement":"Les petites collectivités pourraient avoir besoin d'un outil de scénarios plus simple qu'un système de planification complet."}
      ],
      "problemOrOpportunity": {"type":"hypothesis","statement":"Les responsables locaux pourraient manquer d'un moyen transparent de relier des hypothèses démographiques à des capacités de service révisables."},
      "candidate": {
        "title":"Canevas de capacité communale",
        "summary":"Un calculateur explicable qui transforme des hypothèses démographiques choisies par l'utilisateur en scénarios de capacité, sans présenter ces scénarios comme des prévisions.",
        "beneficiaries":["collectivités locales","gestionnaires de services de proximité","associations de planification"],
        "mechanism":["importer un indicateur daté","faire varier des hypothèses visibles","produire un tableau de scénarios et questions à vérifier"],
        "limits":["la série nationale ne décrit pas la répartition locale","aucune demande de service n'est mesurée","aucune causalité n'est établie"],
        "risks":["fausse précision","décision budgétaire fondée sur un indicateur trop agrégé"],
        "openQuestions":["Quelles données locales autorisées complètent l'indicateur national ?","Quel service pilote justifierait un test ?"]
      },
      "claims": [
        {"type":"fact","statement":"Les trois valeurs collectées sont 14 111 034, 14 462 724 et 14 814 460 pour 2023, 2024 et 2025.","citationIds":["wb-2023","wb-2024","wb-2025"]},
        {"type":"estimate","statement":"La différence arithmétique entre 2023 et 2025 est de 703 426 personnes ; elle n'est pas une projection locale.","citationIds":["wb-2023","wb-2025"]},
        {"type":"hypothesis","statement":"Un canevas de scénarios pourrait réduire le temps de préparation d'une discussion de capacité.","citationIds":[]},
        {"type":"recommendation","statement":"Tester d'abord un seul service et afficher toutes les hypothèses de calcul.","citationIds":[]},
        {"type":"validation_question","statement":"Des responsables locaux utilisent-ils aujourd'hui ces données pour dimensionner un service ?","citationIds":[]}
      ],
      "editorialReview":{"evidenceStrength":5,"userNeedSignal":2,"novelty":3,"feasibility":4,"responsibility":5,"total":19,"outcome":"human_review","explanation":"Données solides et mécanisme borné ; le besoin utilisateur local n'est pas encore observé."},
      "simulatorScenario":"success",
      "publicationState":"human_review_required"
    },
    {
      "id": "africa-funding-translation",
      "evidenceMode": "live_minimized",
      "rightsBasis": "temporary_analysis",
      "evidence": [
        {"id":"tc-fund","sourceId":"techcrunch-rss","collectedIdentifier":"https://techcrunch.com/?p=3156817","fixtureFile":"editorial/research/fixtures/live-sample-minimized.json","fixturePointer":"/records/techcrunch-africa-fund","statement":"Le flux TechCrunch daté du 26 août 2026 titre sur le second fonds africain de Ventures Platform et son résumé de flux mentionne 84 millions de dollars ainsi qu'un périmètre au-delà du Nigeria.","sourceUrl":"https://techcrunch.com/2026/08/26/ventures-platform-goes-bigger-and-broader-with-its-second-africa-fund/"}
      ],
      "interpretationAngles":[{"type":"hypothesis","statement":"Une annonce d'investissement panafricain peut signaler de nouvelles thèses à traduire en questions concrètes pour des fondateurs locaux."}],
      "problemOrOpportunity":{"type":"hypothesis","statement":"Des porteurs de projet pourraient voir l'annonce sans comprendre quelles preuves locales préparer ni si leur problème correspond réellement à la thèse du fonds."},
      "candidate":{
        "title":"Décodeur local de thèses d'investissement",
        "summary":"Une fiche de lecture qui sépare l'annonce sourcée, les secteurs explicitement cités et les questions locales à valider, sans promettre d'accès au financement.",
        "beneficiaries":["fondateurs africains","incubateurs","réseaux d'accompagnement"],
        "mechanism":["citer l'annonce originale","extraire uniquement les critères explicitement publiés","générer un entretien de validation locale"],
        "limits":["un article secondaire n'est pas le mandat du fonds","aucune admissibilité n'est déduite"],
        "risks":["surinterprétation d'une levée de fonds","incitation à adapter artificiellement un projet"],
        "openQuestions":["Le fonds publie-t-il une thèse primaire et des critères vérifiables ?","Quels fondateurs trouvent cette traduction utile ?"]
      },
      "claims":[
        {"type":"fact","statement":"Le titre, la date, l'auteur, l'URL et le bref résumé ont été collectés dans le flux officiel TechCrunch.","citationIds":["tc-fund"]},
        {"type":"hypothesis","statement":"La traduction locale d'une thèse d'investissement pourrait améliorer la préparation des fondateurs.","citationIds":[]},
        {"type":"recommendation","statement":"Remonter à une source primaire du fonds avant de produire une fiche utilisable.","citationIds":[]},
        {"type":"validation_question","statement":"Les fondateurs ciblés déclarent-ils un problème de compréhension des critères ?","citationIds":[]}
      ],
      "editorialReview":{"evidenceStrength":3,"userNeedSignal":2,"novelty":3,"feasibility":4,"responsibility":4,"total":16,"outcome":"hold","explanation":"Signal pertinent, mais source secondaire et besoin utilisateur non établi."},
      "simulatorScenario":"success",
      "publicationState":"human_review_required"
    },
    {
      "id":"innovation-adoption-interviews",
      "evidenceMode":"live_minimized",
      "rightsBasis":"compatible_license",
      "evidence":[
        {"id":"arxiv-adoption","sourceId":"arxiv","collectedIdentifier":"http://arxiv.org/abs/1208.2589v1","fixtureFile":"editorial/research/fixtures/live-sample-minimized.json","fixturePointer":"/records/arxiv-adoption","statement":"Les métadonnées arXiv indiquent un article intitulé Why, when, and how fast innovations are adopted, soumis le 10 août 2012 par Sebastian Goncalves.","sourceUrl":"https://arxiv.org/abs/1208.2589v1"}
      ],
      "interpretationAngles":[{"type":"hypothesis","statement":"Les équipes pourraient gagner à distinguer motivation, moment et vitesse d'adoption dans leurs entretiens."}],
      "problemOrOpportunity":{"type":"hypothesis","statement":"Les recherches produit risquent de réduire l'adoption à une intention générale, sans observer ses déclencheurs ni son rythme."},
      "candidate":{
        "title":"Guide d'entretien en trois temps d'adoption",
        "summary":"Un guide qui fait documenter séparément pourquoi une personne adopte, à quel moment et à quel rythme, puis relie chaque réponse à une preuve.",
        "beneficiaries":["chercheurs produit","équipes innovation","incubateurs"],
        "mechanism":["questions structurées","journal de citations","comparaison manuelle de segments"],
        "limits":["le contenu scientifique n'a pas été évalué dans ce cas","la métadonnée seule ne valide pas le cadre"],
        "risks":["donner une autorité scientifique injustifiée au guide"],
        "openQuestions":["Le texte intégral et sa méthode soutiennent-ils réellement ces trois dimensions ?"]
      },
      "claims":[
        {"type":"fact","statement":"L'article et ses métadonnées d'auteur et de date existent dans l'échantillon collecté.","citationIds":["arxiv-adoption"]},
        {"type":"hypothesis","statement":"Séparer trois dimensions d'adoption pourrait améliorer les entretiens.","citationIds":[]},